{
  "$schema": "https://json-schema.org/draft/2020-12/schema",
  "$id": "https://wassal.invalid/content/1/item.schema.json",
  "title": "Item",
  "description": "An apartment item with 1 to 3 style variants at the same price.",
  "type": "object",
  "required": [
    "item_id",
    "room_id",
    "name",
    "order",
    "slot",
    "variants"
  ],
  "properties": {
    "item_id": {
      "$ref": "common.schema.json#/$defs/ItemId"
    },
    "room_id": {
      "$ref": "common.schema.json#/$defs/RoomId"
    },
    "name": {
      "$ref": "common.schema.json#/$defs/LocalizedText"
    },
    "order": {
      "type": "integer",
      "minimum": 1
    },
    "slot": {
      "$ref": "#/$defs/ItemSlot"
    },
    "comment": {
      "$ref": "common.schema.json#/$defs/LocalizedText"
    },
    "variants": {
      "type": "array",
      "items": {
        "$ref": "#/$defs/ItemVariant"
      },
      "minItems": 1,
      "maxItems": 3
    }
  },
  "additionalProperties": false,
  "$defs": {
    "ItemVariant": {
      "description": "A style variant of an item.",
      "type": "object",
      "required": [
        "variant_id",
        "name",
        "art"
      ],
      "properties": {
        "variant_id": {
          "type": "string",
          "pattern": "^[a-z][a-z0-9_]{1,31}$"
        },
        "name": {
          "$ref": "common.schema.json#/$defs/LocalizedText"
        },
        "art": {
          "$ref": "common.schema.json#/$defs/Slug"
        },
        "comment": {
          "$ref": "common.schema.json#/$defs/LocalizedText"
        }
      },
      "additionalProperties": false
    },
    "ItemSlot": {
      "description": "Where the piece sits in its room's drawing, in a 358×300 design space.",
      "type": "object",
      "additionalProperties": false,
      "required": [
        "x",
        "y",
        "w",
        "h"
      ],
      "properties": {
        "x": {
          "type": "integer",
          "minimum": 0,
          "maximum": 334
        },
        "y": {
          "type": "integer",
          "minimum": 0,
          "maximum": 276
        },
        "w": {
          "type": "integer",
          "minimum": 24,
          "maximum": 358
        },
        "h": {
          "type": "integer",
          "minimum": 24,
          "maximum": 300
        }
      }
    }
  }
}
